{
  "schema_version": "1.0",
  "run_id": "c4ee126c8cca6a7d",
  "seed": 4,
  "spec_path": "_tmp_phase11_cli\\_plan\\seeds\\cwe416_plan_005.json",
  "spec_hash": "2d4f024661fa90783b15ad75d40545d1d3564928f849181ae10f39df7e7b1316",
  "source_root": "examples\\local_targets\\moderate\\src",
  "source_hash": "de7a8f35aa77c74f",
  "pipeline_version": "0.1.0.dev0",
  "timestamp_utc": "2026-04-07T02:14:01Z",
  "validation_verdict": {
    "passed": true,
    "checks": [
      {
        "name": "mutation_applied",
        "status": "pass",
        "reason": "1 mutation(s) applied."
      },
      {
        "name": "good_tree_integrity",
        "status": "pass",
        "reason": "good/ringbuf.c is byte-identical to the original source."
      },
      {
        "name": "bad_tree_changed",
        "status": "pass",
        "reason": "bad/ringbuf.c contains the expected mutation and differs from good/."
      },
      {
        "name": "mutation_scope",
        "status": "pass",
        "reason": "Exactly 1 file changed: ringbuf.c"
      },
      {
        "name": "simple_syntax_sanity",
        "status": "pass",
        "reason": "Mutated line 31 has balanced parentheses."
      }
    ]
  }
}
