{
  "schema_version": "1.0",
  "run_id": "e523573989f45d5e",
  "seed": 5,
  "spec_path": "_tmp_phase11_minimal\\_plan\\seeds\\cwe476_plan_008.json",
  "spec_hash": "1861151f1f614640c05fc95ecfc72a56bcfe12fba9aece19dbc5f43ae83ad39b",
  "source_root": "examples\\local_targets\\minimal\\src",
  "source_hash": "9468702101220acb",
  "pipeline_version": "0.1.0.dev0",
  "timestamp_utc": "2026-04-07T02:14:13Z",
  "validation_verdict": {
    "passed": true,
    "checks": [
      {
        "name": "mutation_applied",
        "status": "pass",
        "reason": "1 mutation(s) applied."
      },
      {
        "name": "good_tree_integrity",
        "status": "pass",
        "reason": "good/counter.c is byte-identical to the original source."
      },
      {
        "name": "bad_tree_changed",
        "status": "pass",
        "reason": "bad/counter.c contains the expected mutation and differs from good/."
      },
      {
        "name": "mutation_scope",
        "status": "pass",
        "reason": "Exactly 1 file changed: counter.c"
      },
      {
        "name": "simple_syntax_sanity",
        "status": "pass",
        "reason": "Mutated line 19 has balanced parentheses."
      }
    ]
  }
}
