{
  "schema_version": "1.0",
  "run_id": "b58612ccecb7704c",
  "seed": 1,
  "spec_path": "_tmp_phase11_e2e\\_plan\\seeds\\cwe416_plan_002.json",
  "spec_hash": "6a629115a3e89b75770f5ccf4e62c66bbb08a077839c8435a1dc49dc5a189faa",
  "source_root": "examples\\local_targets\\moderate\\src",
  "source_hash": "de7a8f35aa77c74f",
  "pipeline_version": "0.1.0.dev0",
  "timestamp_utc": "2026-04-07T02:13:54Z",
  "validation_verdict": {
    "passed": true,
    "checks": [
      {
        "name": "mutation_applied",
        "status": "pass",
        "reason": "1 mutation(s) applied."
      },
      {
        "name": "good_tree_integrity",
        "status": "pass",
        "reason": "good/arena.c is byte-identical to the original source."
      },
      {
        "name": "bad_tree_changed",
        "status": "pass",
        "reason": "bad/arena.c contains the expected mutation and differs from good/."
      },
      {
        "name": "mutation_scope",
        "status": "pass",
        "reason": "Exactly 1 file changed: arena.c"
      },
      {
        "name": "simple_syntax_sanity",
        "status": "pass",
        "reason": "Mutated line 32 has balanced parentheses."
      }
    ]
  }
}
