{
  "schema_version": "1.0",
  "run_id": "b239fccdd593f6e9",
  "seed": 16,
  "spec_path": "examples\\seeds\\sandbox\\cwe476_sb_007.json",
  "spec_hash": "63569108d4a784134440ff2d50a9edbf8ff4b1ae738e762f53a4e2e9c4ef5b76",
  "source_root": "examples\\sandbox_eval\\src",
  "source_hash": "429c7630adfae14c",
  "pipeline_version": "0.1.0.dev0",
  "timestamp_utc": "2026-04-07T01:54:16Z",
  "validation_verdict": {
    "passed": true,
    "checks": [
      {
        "name": "mutation_applied",
        "status": "pass",
        "reason": "1 mutation(s) applied."
      },
      {
        "name": "good_tree_integrity",
        "status": "pass",
        "reason": "good/htable.c is byte-identical to the original source."
      },
      {
        "name": "bad_tree_changed",
        "status": "pass",
        "reason": "bad/htable.c contains the expected mutation and differs from good/."
      },
      {
        "name": "mutation_scope",
        "status": "pass",
        "reason": "Exactly 1 file changed: htable.c"
      },
      {
        "name": "simple_syntax_sanity",
        "status": "pass",
        "reason": "Mutated line 46 has balanced parentheses."
      }
    ]
  }
}
